{
  "node": "catalog",
  "kind": "service",
  "t_from": -600,
  "t_to": 45,
  "step_secs": 25,
  "axes": ["t", "rps", "err", "p95", "sat", "up"],
  "points": [
    [-600, 29.8, 0.0, 140, 44, 1],
    [-575, 30.1, 0.0, 142, 45, 1]
  ],
  "baseline": { "rps": 30.0, "err": 0.0, "p95": 141, "sat": 45 },
  "band": { "err_max": 2.0, "p95_max": 212, "sat_max": 60 },
  "sat_label": "pool"
}
